{"manifest_version":1,"notebooks":[{"name":"Takeoff methodology and drawing interpretation","notebook_id":"N01","purpose":"Takeoff methods, plan reading, scale, symbols, and evidence-grounded drawing interpretation."},{"name":"Duct, fittings, and SMACNA","notebook_id":"N02","purpose":"Airside duct, fitting, terminal, damper, accessory, and lawfully accessible SMACNA research."},{"name":"Hydronic, refrigerant, and condensate piping","notebook_id":"N03","purpose":"Hydronic, refrigerant, condensate, pipe, fitting, valve, specialty, and riser research."},{"name":"Equipment, schedules, and manufacturer literature","notebook_id":"N04","purpose":"Equipment schedules, manufacturer product data, installation instructions, controls, and reconciliation."},{"name":"Insulation, supports, seismic, and vibration","notebook_id":"N05","purpose":"Insulation systems, supports, hangers, seismic restraint, and vibration isolation."},{"name":"NYC/NYS codes, public work, labor, and tax","notebook_id":"N06","purpose":"New York City and State official requirements, public work, prevailing wage, labor, and tax."},{"name":"Pricing, procurement, and vendor intelligence","notebook_id":"N07","purpose":"Public pricing sources, procurement, lead time, vendor intelligence, and pricing-source limitations."},{"name":"OCR, computer vision, PDF/CAD, and AI models","notebook_id":"N08","purpose":"Document parsing, OCR, geometry, vision models, PDF/CAD tooling, datasets, and model evaluation."},{"name":"Estimating, bidding, proposals, and risk","notebook_id":"N09","purpose":"Estimate structure, bid leveling, proposals, exclusions, allowances, alternates, and commercial risk."},{"name":"Project management, submittals, TAB, and closeout","notebook_id":"N10","purpose":"Post-award project controls, submittals, coordination, TAB, commissioning, turnover, and closeout."},{"name":"HELIOS software architecture, database, and agent engineering","notebook_id":"N11","purpose":"Software architecture, contracts, databases, provenance, testing, model orchestration, and agent engineering."}],"protocol":"helios.build.notebook-manifest/v1","supersedes_manifest_sha256":null}